<?xml version="1.0"?>
<!-- RDF Schema: telegraphics RDF -->
<RDFEntityTypes xmlns:xsi="http://www.w3.org/2001/XMLSchema-instance" xsi:noNamespaceSchemaLocation="RDFSchema.xsd">

  <RDFSchemaMetadata>
    <NameSpace>gn=http://www.geonames.org/ontology#</NameSpace>
    <NameSpace>metric=http://www.telegraphis.net/ontology/measurement/metric#</NameSpace>
    <NameSpace>money=http://telegraphis.net/ontology/money/money#</NameSpace>
    <NameSpace>owl=http://www.w3.org/2002/07/owl#</NameSpace>
    <NameSpace>rdf=http://www.w3.org/1999/02/22-rdf-syntax-ns#</NameSpace>
    <NameSpace>quantity=http://www.telegraphis.net/ontology/measurement/quantity#</NameSpace>
    <NameSpace>code=http://telegraphis.net/ontology/measurement/code#</NameSpace>
    <NameSpace>geographis=http://telegraphis.net/ontology/geography/geography#</NameSpace>
    <NameSpace>measurement=http://www.telegraphis.net/ontology/measurement/measurement#</NameSpace>
  </RDFSchemaMetadata>
  <RDFEntityType rdftype="http://www.geonames.org/ontology#Country">
    <RDFEntityTypeName>Country</RDFEntityTypeName>
    <SimpleAttrOfRDFEntityType namespace="http://telegraphis.net/ontology/geography/geography#">isoAlpha3</SimpleAttrOfRDFEntityType>
    <SimpleAttrOfRDFEntityType namespace="http://telegraphis.net/ontology/geography/geography#">isoAlpha2</SimpleAttrOfRDFEntityType>
    <SimpleAttrOfRDFEntityType namespace="http://telegraphis.net/ontology/money/money#">name</SimpleAttrOfRDFEntityType>
    <SimpleAttrOfRDFEntityType namespace="http://www.geonames.org/ontology#">featureCode</SimpleAttrOfRDFEntityType>
    <SimpleAttrOfRDFEntityType namespace="http://www.geonames.org/ontology#">featureClass</SimpleAttrOfRDFEntityType>
    <SimpleAttrOfRDFEntityType namespace="http://telegraphis.net/ontology/money/money#">isoNumeric</SimpleAttrOfRDFEntityType>
    <SimpleAttrOfRDFEntityType namespace="http://telegraphis.net/ontology/geography/geography#">onContinent</SimpleAttrOfRDFEntityType>
    <SimpleAttrOfRDFEntityType namespace="http://www.geonames.org/ontology#">population</SimpleAttrOfRDFEntityType>
    <SimpleAttrOfRDFEntityType namespace="http://telegraphis.net/ontology/geography/geography#">currency</SimpleAttrOfRDFEntityType>
    <MultiAttrOfRDFEntityType namespace="http://telegraphis.net/ontology/geography/geography#">isoShortName</MultiAttrOfRDFEntityType>
    <RDFBinaryRelationshipType namespace="http://telegraphis.net/ontology/geography/geography#">
      <RDFRelationshipName>currency</RDFRelationshipName>
      <FromRDFEntityType>Country</FromRDFEntityType>
      <ToRDFEntityType>Currency</ToRDFEntityType>
      <CardinalityRatio>1:1</CardinalityRatio>
    </RDFBinaryRelationshipType>
  </RDFEntityType>
  <RDFEntityType rdftype="http://telegraphis.net/ontology/money/money#Currency">
    <RDFEntityTypeName>Currency</RDFEntityTypeName>
    <SimpleAttrOfRDFEntityType namespace="http://telegraphis.net/ontology/money/money#">name</SimpleAttrOfRDFEntityType>
    <SimpleAttrOfRDFEntityType namespace="http://telegraphis.net/ontology/money/money#">isoNumeric</SimpleAttrOfRDFEntityType>
    <SimpleAttrOfRDFEntityType namespace="http://telegraphis.net/ontology/money/money#">minorExponent</SimpleAttrOfRDFEntityType>
    <SimpleAttrOfRDFEntityType namespace="http://telegraphis.net/ontology/money/money#">isoAlpha</SimpleAttrOfRDFEntityType>
    <SimpleAttrOfRDFEntityType namespace="http://telegraphis.net/ontology/money/money#">shortName</SimpleAttrOfRDFEntityType>
    <SimpleAttrOfRDFEntityType namespace="http://telegraphis.net/ontology/money/money#">minorName</SimpleAttrOfRDFEntityType>
    <SimpleAttrOfRDFEntityType namespace="http://telegraphis.net/ontology/money/money#">currencyOf</SimpleAttrOfRDFEntityType>
    <RDFBinaryRelationshipType namespace="http://telegraphis.net/ontology/money/money#">
      <RDFRelationshipName>currencyOf</RDFRelationshipName>
      <FromRDFEntityType>Currency</FromRDFEntityType>
      <ToRDFEntityType>Country</ToRDFEntityType>
      <CardinalityRatio>1:N</CardinalityRatio>
    </RDFBinaryRelationshipType>
  </RDFEntityType>
  <RDFEntityType rdftype="http://www.telegraphis.net/ontology/geography/geography#Continent">
    <RDFEntityTypeName>Continent</RDFEntityTypeName>
    <SimpleAttrOfRDFEntityType namespace="http://telegraphis.net/ontology/money/money#">name</SimpleAttrOfRDFEntityType>
    <SimpleAttrOfRDFEntityType namespace="http://www.geonames.org/ontology#">featureClass</SimpleAttrOfRDFEntityType>
    <SimpleAttrOfRDFEntityType namespace="http://www.geonames.org/ontology#">featureCode</SimpleAttrOfRDFEntityType>
    <SimpleAttrOfRDFEntityType namespace="http://www.geonames.org/ontology#">population</SimpleAttrOfRDFEntityType>
  </RDFEntityType>
  <RDFEntityType rdftype="http://www.geonames.org/ontology#Capital">
    <RDFEntityTypeName>Capital</RDFEntityTypeName>
    <SimpleAttrOfRDFEntityType namespace="http://telegraphis.net/ontology/money/money#">name</SimpleAttrOfRDFEntityType>
    <SimpleAttrOfRDFEntityType namespace="http://www.geonames.org/ontology#">featureClass</SimpleAttrOfRDFEntityType>
    <SimpleAttrOfRDFEntityType namespace="http://www.geonames.org/ontology#">featureCode</SimpleAttrOfRDFEntityType>
    <SimpleAttrOfRDFEntityType namespace="http://telegraphis.net/ontology/geography/geography#">capitalOf</SimpleAttrOfRDFEntityType>
    <RDFBinaryRelationshipType namespace="http://telegraphis.net/ontology/geography/geography#">
      <RDFRelationshipName>capitalOf</RDFRelationshipName>
      <FromRDFEntityType>Capital</FromRDFEntityType>
      <ToRDFEntityType>Country</ToRDFEntityType>
      <CardinalityRatio>1:1</CardinalityRatio>
    </RDFBinaryRelationshipType>
  </RDFEntityType>
</RDFEntityTypes>